{
  "passage": "John 11:1-44",
  "series": "Life and Death",
  "date": "2026-04-13",
  "teacher_name": "TEACHER_NAME",
  "big_idea": "Jesus delays not because he is indifferent, but because he is after something bigger than comfort.",
  "key_tension": "The God who could have prevented suffering chose not to, and that choice was love.",
  "group_need": "People in the room are carrying grief and wondering where God is in it.",
  "desired_response": "Trust that God is present in the delay, not absent from it.",
  "the_turn": "The moment shifts from Mary and Martha questioning Jesus to Jesus weeping with them.",
  "opening_question": "Read verses 5 and 6 together. What does the word 'so' do there, and does it sit right with you?",
  "sticking_point": "Someone will ask why God does not heal now. Do not resolve it fast; let the text hold the tension before you answer.",
  "supporting_passages": [
    {
      "reference": "Psalm 13:1-2",
      "note": "The cry of how long, a parallel to Martha and Mary."
    },
    {
      "reference": "Romans 8:28",
      "note": "God works all things — including delay — for good."
    }
  ],
  "illustration_idea": "A surgeon who makes you wait because timing matters more than speed."
}
